{
  "deploymentId": "88888888-8888-4888-8888-888888888888",
  "pluginId": "dev.opsweave.hello",
  "pluginVersion": "0.0.1",
  "desiredReplicas": 2,
  "generation": 1,
  "placement": {
    "nodeSelector": {
      "workload": "general"
    },
    "maxInstancesPerNode": 1
  },
  "resourceLimits": {
    "cpuMillis": 500,
    "memoryMiB": 128
  }
}
